{
  "meta": {
    "title": "Переходная зона: понятия Кирхгофа, Меса-Верде, переселения, Чичимекская война, Хемес, восстание пуэбло, два «мира покупкой», граница",
    "schema": "schema/transition.schema.json",
    "license": "CC BY 4.0",
    "notes": [
      "Используется рисунками главы 4 (tools/figures.py): 4.1 — области Кирхгофа и граница, 4.5 — Меса-Верде, 4.6 — переселения конца XIII в., 4.7 — Чичимекская война, 4.8 — Хемес, 4.9 — восстание пуэбло, 4.10 — дважды «мир покупкой», 4.12 — граница поперёк земли оодхам.",
      "Чако и Пакиме на рис. 4.1 берутся из complex.json.",
      "Координаты ориентировочные; откуда сверены — в поле coords."
    ]
  },
  "places": [
    {
      "id": "mexico_city",
      "name": "Мехико",
      "lon": -99.13,
      "lat": 19.44,
      "approx": true,
      "coords": "Natural Earth 1:10m populated places",
      "role": "landmark",
      "sources": []
    },
    {
      "id": "casa_grande",
      "name": "Каса-Гранде",
      "lon": -111.53,
      "lat": 33.0,
      "approx": true,
      "coords": "Wikidata (Casa Grande Ruins National Monument)",
      "role": "landmark",
      "note": "Большой дом в долине Хилы.",
      "sources": []
    },
    {
      "id": "mesa_verde",
      "name": "Меса-Верде",
      "lon": -108.49,
      "lat": 37.18,
      "approx": true,
      "coords": "Wikidata (Mesa Verde National Park)",
      "role": "landmark",
      "sources": []
    },
    {
      "id": "santa_fe",
      "name": "Санта-Фе",
      "lon": -105.94,
      "lat": 35.69,
      "approx": true,
      "coords": "Natural Earth 1:10m populated places",
      "role": "spanish",
      "sources": [
        {
          "ref": "hackett1911",
          "loc": "с. 97–100, 104–106 и разд. о Ислете и об отступлении — по сноске главы"
        }
      ],
      "note": "Столица провинции; здесь собрались уцелевшие испанцы, здесь же сожгли архивы."
    },
    {
      "id": "sinaloa_mouth",
      "name": "устье Синалоа",
      "lon": -108.49,
      "lat": 25.28,
      "approx": true,
      "coords": "Wikidata (Sinaloa River, mouth); в техзадании было ≈ −108.6, 25.4",
      "role": "edge",
      "sources": [
        {
          "ref": "kirchhoff1960",
          "loc": "разд. «Límites de Mesoamérica a mediados del siglo XVI»",
          "note": "«desde el río Panúco al Sinaloa pasando por el Lerma»"
        }
      ]
    },
    {
      "id": "lerma",
      "name": "Лерма",
      "lon": -101.24,
      "lat": 20.59,
      "approx": true,
      "coords": "Natural Earth 1:10m rivers: северная излучина Лермы",
      "role": "edge",
      "note": "Кирхгоф называет реку, а не место на ней; точка — северная излучина, условно.",
      "sources": [
        {
          "ref": "kirchhoff1960",
          "loc": "разд. «Límites de Mesoamérica a mediados del siglo XVI»"
        }
      ]
    },
    {
      "id": "panuco_mouth",
      "name": "устье Пануко",
      "lon": -97.78,
      "lat": 22.27,
      "approx": true,
      "coords": "Natural Earth 1:10m rivers, конец линии реки; в техзадании было ≈ −97.85",
      "role": "edge",
      "sources": [
        {
          "ref": "kirchhoff1960",
          "loc": "разд. «Límites de Mesoamérica a mediados del siglo XVI»"
        }
      ]
    },
    {
      "id": "tlaxcala",
      "name": "Тлашкала",
      "lon": -98.24,
      "lat": 19.32,
      "approx": true,
      "coords": "Natural Earth 1:10m populated places",
      "role": "origin",
      "note": "Переселенцы вышли из монастыря в Тотолаке (Тлашкала) в начале июня 1591 г.",
      "sources": [
        {
          "ref": "rojasgalvan2016",
          "loc": "с. 74"
        }
      ]
    },
    {
      "id": "zacatecas",
      "name": "Сакатекас",
      "lon": -102.57,
      "lat": 22.77,
      "approx": true,
      "coords": "Natural Earth 1:10m populated places",
      "role": "mine",
      "when": {
        "start": 1546,
        "end": 1546,
        "dating": "documented",
        "label": "около 1546 г."
      },
      "note": "Серебро найдено около 1546 г.; в тексте главы и у Руиса Гвадалахары — «около».",
      "sources": [
        {
          "ref": "ruizguadalajara2010",
          "loc": "с. 25, 36, 40, 43, 53",
          "note": "страница факта по техзаданию главы; отдельно не сверена — сайт журнала был недоступен"
        }
      ]
    },
    {
      "id": "san_luis_potosi",
      "name": "Сан-Луис-Потоси",
      "lon": -100.98,
      "lat": 22.15,
      "approx": true,
      "coords": "Natural Earth 1:10m populated places",
      "role": "mine",
      "when": {
        "start": 1592,
        "end": 1592,
        "dating": "documented"
      },
      "note": "Месторождение нашёл Кальдера в 1592 г., после мира.",
      "sources": [
        {
          "ref": "ruizguadalajara2010",
          "loc": "с. 25, 36, 40, 43, 53",
          "note": "страница факта по техзаданию главы; отдельно не сверена — сайт журнала был недоступен"
        }
      ]
    },
    {
      "id": "colotlan",
      "name": "Колотлан",
      "lon": -103.27,
      "lat": 22.11,
      "approx": true,
      "coords": "Wikipedia (es), город Колотлан",
      "role": "colony",
      "when": {
        "start": 1591,
        "end": 1591,
        "dating": "documented",
        "day": "1591-08-21"
      },
      "note": "Основан Кальдерой 21 августа 1591 г.; пришли сто семей.",
      "sources": [
        {
          "ref": "rojasgalvan2016",
          "loc": "с. 75"
        }
      ]
    },
    {
      "id": "saltillo",
      "name": "Сан-Эстебан-де-ла-Нуэва-Тласкала (Сальтильо)",
      "lon": -101.0,
      "lat": 25.42,
      "approx": true,
      "coords": "Natural Earth 1:10m populated places",
      "role": "colony",
      "when": {
        "start": 1591,
        "end": 1591,
        "dating": "documented"
      },
      "note": "Одна из первоначальных колоний 1591 г.",
      "sources": [
        {
          "ref": "rojasgalvan2016",
          "loc": "с. 73"
        }
      ]
    },
    {
      "id": "parras",
      "name": "Паррас",
      "lon": -102.18,
      "lat": 25.44,
      "approx": true,
      "coords": "Wikipedia (es), Паррас-де-ла-Фуэнте; Natural Earth — 25.42",
      "role": "colony",
      "when": {
        "start": 1598,
        "end": 1598,
        "dating": "documented"
      },
      "note": "Санта-Мария-де-лас-Паррас основали в 1598 г. семьи из Сан-Эстебана (Шеридан Прието); Рохас Гальван упоминает её в одном ряду с колониями 1591 г.",
      "sources": [
        {
          "ref": "sheridan2001",
          "loc": "с. 37"
        },
        {
          "ref": "rojasgalvan2016",
          "loc": "с. 73",
          "note": "упоминание в одном ряду с колониями 1591 г."
        }
      ]
    },
    {
      "id": "kayenta",
      "name": "район Каента",
      "lon": -110.25,
      "lat": 36.71,
      "approx": true,
      "coords": "Wikipedia (en), Kayenta, Arizona; центр условной области",
      "role": "region",
      "radius_km": 45,
      "note": "Район на северо-востоке Аризоны, откуда в 1280-х гг. шли переселенцы.",
      "sources": [
        {
          "ref": "mills2013",
          "loc": "«Results and Discussion», «Conclusions» — по сноске главы"
        }
      ]
    },
    {
      "id": "central_arizona",
      "name": "центральная Аризона",
      "lon": -111.2,
      "lat": 33.55,
      "approx": true,
      "coords": "схема: центр условной области между Солт-Ривер и Хилой",
      "role": "region",
      "radius_km": 95,
      "note": "Куда пришли переселенцы из Каенты; здесь, по осторожной формулировке авторов, начали делать посуду саладо.",
      "sources": [
        {
          "ref": "mills2013",
          "loc": "«Results and Discussion», «Conclusions» — по сноске главы"
        }
      ]
    },
    {
      "id": "rio_grande_north",
      "name": "север долины Рио-Гранде",
      "lon": -106.2,
      "lat": 35.95,
      "approx": true,
      "coords": "схема: центр условной области у плато Пахарито (Los Alamos — Natural Earth 1:10m)",
      "role": "region",
      "radius_km": 65,
      "note": "Куда ушло большинство жителей Меса-Верде; плато Пахарито служило убежищем в засуху.",
      "sources": [
        {
          "ref": "schwindt2016",
          "loc": "«Population Size and Movement»"
        },
        {
          "ref": "bocinsky2014",
          "loc": "«Results»"
        }
      ]
    },
    {
      "id": "hopi",
      "name": "хопи",
      "lon": -110.37,
      "lat": 35.84,
      "approx": true,
      "coords": "Wikipedia (en), First Mesa, Arizona",
      "role": "pueblo",
      "note": "Северная группа, уцелевшая после распада южной сети 1400–1450 гг.; в 1980 г. сюда от Таоса пронесли шнур с узлами.",
      "sources": [
        {
          "ref": "mills2013",
          "loc": "«Results and Discussion», «Conclusions» — по сноске главы"
        },
        {
          "ref": "liebmann2007",
          "loc": "рукопись, с. 1–3, 7, 9, 12, 16–17 — по сноске главы"
        }
      ]
    },
    {
      "id": "zuni",
      "name": "зуни",
      "lon": -108.85,
      "lat": 35.07,
      "approx": true,
      "coords": "Wikidata Q2241166 (Zuni Pueblo)",
      "role": "pueblo",
      "note": "Северная группа, уцелевшая после распада южной сети 1400–1450 гг.",
      "sources": [
        {
          "ref": "mills2013",
          "loc": "«Results and Discussion», «Conclusions» — по сноске главы"
        }
      ]
    },
    {
      "id": "taos",
      "name": "Таос",
      "lon": -105.55,
      "lat": 36.44,
      "approx": true,
      "coords": "Wikipedia (en), Taos Pueblo",
      "role": "pueblo",
      "note": "Сюда перебрался Попе; отсюда разослал по пуэбло верёвку с узлами.",
      "sources": [
        {
          "ref": "hackett1911",
          "loc": "с. 97–100, 104–106 и разд. о Ислете и об отступлении — по сноске главы"
        },
        {
          "ref": "liebmann2007",
          "loc": "рукопись, с. 1–3, 7, 9, 12, 16–17 — по сноске главы"
        }
      ]
    },
    {
      "id": "picuris",